{
  "walletSize": 1000,
  "riskPerEventPct": 0.0025,
  "minShares": 5,
  "tickSize": 0.01,
  "maxGrossExposurePct": 0.025,
  "maxCycles": 3,
  "entryWindowStartSec": 240,
  "entryWindowEndSec": 60,
  "hedgeCutoffSec": 10,
  "minEdge": 0.06,
  "cancelEdge": 0.03,
  "minDirectionalProbability": 0.57,
  "maxSpread": 0.05,
  "cancelSpread": 0.07,
  "rungEdgeStep": 0.02,
  "hedgeMinWorstImprovementUsd": 0.05,
  "hedgeMinProtectedProfitUsd": 0.02,
  "makerTimeoutSec": 20,
  "makerFillMode": "strict_cross",
  "cancelLatencyTicks": 1,
  "takerLatencyTicks": 1,
  "requireQuality": true,
  "minCoverage": 0.99,
  "minTicksBeforeEntry": 8,
  "shockSigma": 2.5,
  "minSigma": 8,
  "sigmaMultiplier": 1,
  "modelWeight": 0.66,
  "driftWeight": 0.42,
  "driftClampSigma": 0.9,
  "accelerationWeight": 0.28,
  "bookImbalanceWeight": 0.2,
  "momentumSec": 7,
  "slowMomentumSec": 26,
  "slowMomentumWeight": 0.28,
  "volLookbackSec": 55,
  "applyPolymarketFees": true,
  "polymarketFeeCategory": "crypto",
  "polymarketFeeRate": 0.07
}
